{
  "format": 2,
  "name": "example-theme",
  "title": "Example theme",
  "version": "1.0.0",
  "entry": {
    "type": "spa",
    "module": "dist/index.js"
  },
  "engines": {
    "txboard": ">=3.6",
    "contract": "core-browser/v1",
    "browser": ">=1 <2"
  },
  "assets": [
    {
      "path": "dist/index.js",
      "integrity": "sha256-BsX0E4Aunyt7x/vhF8ZiSpsfyifYgukNmxkd4Bub/Yg="
    }
  ],
  "dependencies": {
    "runtime": []
  },
  "security": {
    "csp": "strict",
    "remoteCode": false
  },
  "browser": {
    "contract": "core-browser/v1",
    "sdk": {
      "package": "@txboard/theme-sdk",
      "version": ">=0.2.0 <1.0.0"
    },
    "capabilities": [
      "identity.session.create",
      "catalog.offers.list",
      "commerce.orders.list"
    ]
  }
}
